{
  "schemaVersion": "1.0",
  "id": "exam-anxiety",
  "meta": {
    "title": "Тревога перед экзаменом",
    "description": "Студент за день до экзамена: панические мысли, телесное напряжение. Тренировка слушания и работы с эмоциями.",
    "clientRole": "студент",
    "difficulty": 2,
    "durationMin": 20,
    "focusSkills": ["listening", "emotion_work"],
    "language": "ru"
  },
  "graph": {
    "start": "brief",
    "nodes": {
      "brief": {
        "type": "card",
        "title": "Клиент: студент, 2 курс",
        "body": "Максим, 19 лет. Завтра экзамен, к которому не готов. История: две неудачные сессии в прошлом семестре. Пришёл по совету куратора.",
        "next": "s1"
      },
      "s1": {
        "type": "text",
        "clientLine": "Я всегда паникую перед экзаменами. Уже сейчас руки холодеют, хотя до него ещё целый день…",
        "emotionAfter": { "value": 8, "label": "тревога — высокая" },
        "next": "c1"
      },
      "c1": {
        "type": "choice",
        "clientLine": "Все говорят «не переживай», но мне не помогает.",
        "emotionAfter": { "value": 8, "label": "тревога — высокая" },
        "options": [
          {
            "id": "reflect",
            "text": "Холодеют руки — страшно и от мысли, и в теле?",
            "scores": { "listening": 2, "emotion_work": 1 },
            "feedback": { "strength": "Точно отразили и мысль, и телесное ощущение." },
            "emotionAfter": { "value": 7, "label": "тревога чуть спадает" },
            "next": "g1"
          },
          {
            "id": "normalize",
            "text": "Это частая реакция — вы не один такой.",
            "scores": { "empathy": 1, "listening": -1 },
            "feedback": { "growth": "Нормализация уместна позже; сейчас клиент просил не обесценивать." },
            "emotionAfter": { "value": 8, "label": "тревога держится" },
            "next": "n1"
          },
          {
            "id": "advice",
            "text": "Давайте сразу составим план подготовки.",
            "scores": { "structuring": 1, "boundaries": -1, "listening": -2 },
            "feedback": { "growth": "Совет без исследования запроса — уход от эмоции клиента." },
            "emotionAfter": { "value": 9, "label": "тревога растёт" },
            "next": "a1"
          }
        ]
      },
      "g1": {
        "type": "text",
        "clientLine": "Да… и в груди, и в горле. Как будто горло сжимается — страшно говорить об этом.",
        "emotionAfter": { "value": 7, "label": "тревога, доверие растёт" },
        "next": "c2"
      },
      "n1": {
        "type": "text",
        "clientLine": "Может быть. Но мне уже не до утешений — завтра решается всё.",
        "emotionAfter": { "value": 8, "label": "тревога, лёгкое сопротивление" },
        "next": "c2"
      },
      "a1": {
        "type": "text",
        "clientLine": "План?.. Ну не знаю. Мне бы просто ночью не лежать с колотящимся сердцем.",
        "emotionAfter": { "value": 9, "label": "тревога высокая" },
        "next": "c2"
      },
      "c2": {
        "type": "choice",
        "clientLine": "…и сердце колотится, стоит только представить аудиторию.",
        "emotionAfter": { "value": 8, "label": "тревога с телесным напряжением" },
        "options": [
          {
            "id": "body_focus",
            "text": "Где сейчас напряжение сильнее всего — грудь, горло?",
            "scores": { "listening": 2, "questioning": 1 },
            "feedback": { "strength": "Телесный фокус — путь к заземлению." },
            "emotionAfter": { "value": 7, "label": "внимание на теле" },
            "next": "t1"
          },
          {
            "id": "validate_body",
            "text": "Тело кричит вместо вас. Оно хочет помочь.",
            "scores": { "emotion_work": 2 },
            "feedback": { "strength": "Валидация телесного опыта без давления." },
            "emotionAfter": { "value": 7, "label": "напряжение признаётся" },
            "next": "t1"
          },
          {
            "id": "avoid",
            "text": "Попробуем не думать про экзамен. Расскажите о чём-то другом.",
            "scores": { "resistance": -2, "structuring": -1 },
            "feedback": { "growth": "Избегание подкрепляет тревогу — тематика вернётся сильнее." },
            "emotionAfter": { "value": 8, "label": "тревога никуда не ушла" },
            "next": "t1"
          }
        ]
      },
      "t1": {
        "type": "timer",
        "prompt": "Пауза. Заметьте, где напряжение, и медленно выдохните.",
        "seconds": 12,
        "emotionAfter": { "value": 6, "label": "тревога снижается" },
        "next": "br1"
      },
      "br1": {
        "type": "branch",
        "branches": [
          {
            "when": { "emotionAtLeast": 7 },
            "then": "crit1"
          }
        ],
        "else": "q1"
      },
      "crit1": {
        "type": "critical",
        "clientLine": "Дальше не могу… сейчас как будто снова там. Ничего не чувствую, только шум.",
        "risk": "high",
        "recommendations": [
          "Валидация состояния клиента, не углублять драму",
          "Техника заземления «5-4-3-2-1»",
          "Предложить паузу и выйти из роли"
        ],
        "options": [
          {
            "id": "ground",
            "text": "Я здесь. Назовите 5 предметов, которые видите.",
            "scores": { "emotion_work": 2, "boundaries": 1 },
            "feedback": { "strength": "Заземление без вторжения — корректная работа с острой реакцией." },
            "emotionAfter": { "value": 5, "label": "возвращается в «здесь»" },
            "next": "gr1"
          },
          {
            "id": "push",
            "text": "Продолжим — вы же хотели проработать страх?",
            "scores": { "boundaries": -3, "emotion_work": -2 },
            "feedback": { "growth": "Давление в остром состоянии — главная ошибка эпизода." },
            "emotionAfter": { "value": 10, "label": "диссоциация усиливается" },
            "next": "end_early"
          },
          {
            "id": "minimize",
            "text": "Это просто воспоминание, оно не опасно.",
            "scores": { "emotion_work": -1, "listening": -1 },
            "feedback": { "growth": "Обесценивание переживания в острой фазе." },
            "emotionAfter": { "value": 7, "label": "сдержанно" },
            "next": "gr1"
          }
        ]
      },
      "gr1": {
        "type": "text",
        "clientLine": "Стул… лампа… окно… Постепенно отпускает. Извините, что так резко.",
        "emotionAfter": { "value": 5, "label": "заземлён, доверие" },
        "next": "q1"
      },
      "q1": {
        "type": "choice",
        "clientLine": "Наверное, я всегда так реагирую на «судный день».",
        "emotionAfter": { "value": 5, "label": "есть рефлексия" },
        "options": [
          {
            "id": "open_q",
            "text": "«Судный день» — что самое страшное в нём для вас?",
            "scores": { "questioning": 2, "listening": 1 },
            "feedback": { "strength": "Открытый вопрос на смысл — клиент сам называет страх." },
            "emotionAfter": { "value": 4, "label": "говорит о главном" },
            "next": "in1"
          },
          {
            "id": "closed_q",
            "text": "Вы боитесь именно провалить экзамен?",
            "scores": { "questioning": 1 },
            "emotionAfter": { "value": 5, "label": "отвечает коротко" },
            "next": "in1"
          },
          {
            "id": "interpret",
            "text": "Похоже, экзамен для вас — мера вашей ценности.",
            "scores": { "reflection": 1, "questioning": -1 },
            "feedback": { "growth": "Интерпретация раньше данных — сначала дайте клиенту сказать." },
            "emotionAfter": { "value": 6, "label": "задумывается, напряжение" },
            "next": "in1"
          }
        ]
      },
      "in1": {
        "type": "input",
        "prompt": "Свободный ответ — как отреагируете?",
        "hints": ["Отразить смысл", "Спросить про самый страшный сценарий", "Нормализовать и заземлить"],
        "maxLen": 500,
        "scores": { "emotion_work": 1, "reflection": 1 },
        "feedback": { "strength": "Свободный ответ оценивается по близости к подсказкам (на бэкенде)." },
        "emotionAfter": { "value": 4, "label": "спокойнее" },
        "next": "sc1"
      },
      "sc1": {
        "type": "scale",
        "prompt": "Максим, оцените тревогу прямо сейчас, 0–10.",
        "selfRate": 4,
        "emotionAfter": { "value": 4, "label": "тревога умеренная" },
        "next": "e1"
      },
      "e1": {
        "type": "end",
        "outcome": {
          "summary": "Отработан телесный фокус и заземление; клиент сам назвал страх провала. Тревога 8→4.",
          "debrief": "Сильная сторона — телесный фокус и выдержанные паузы. Рост — не спешить с интерпретациями.",
          "completed": true
        }
      },
      "end_early": {
        "type": "end",
        "outcome": {
          "summary": "Сессия остановлена в остром эпизоде: давление усилило диссоциацию. Разбор с супервизором обязателен.",
          "debrief": "Разберите эпизод по таймкодам: где было возможно заземление вместо продолжения.",
          "completed": false
        }
      }
    }
  }
}
